{
  "schema_version": 1,
  "audience": "family",
  "format": "both",
  "players": {
    "count": 2,
    "names": []
  },
  "host": "self_running",
  "duration_minutes": 30,
  "difficulty": "easy",
  "language": "en",
  "theme": {
    "idea": "A stolen lighthouse lens",
    "tone": "cozy",
    "era": "any"
  },
  "content": {
    "death_allowed": true,
    "scary_level": "mild",
    "reading_load": "medium"
  },
  "personalization": {
    "host_name": "",
    "place": "",
    "inside_jokes": [],
    "dedication": ""
  },
  "puzzle_preferences": {
    "words": "neutral",
    "numbers": "neutral",
    "logic": "neutral",
    "visual": "neutral",
    "crafts": "neutral",
    "deduction": "neutral"
  },
  "equipment": {
    "printer": "color",
    "ink_saving": false,
    "paper": "A4",
    "scissors": true,
    "tape_or_glue": false,
    "envelopes": true
  },
  "assistance": {
    "hints": true,
    "paper_answer_check": true,
    "companion_page": true
  },
  "visuals": {
    "style": "auto",
    "images": "svg",
    "readable_font": false
  },
  "generation": {
    "quality": "best",
    "pick_concept": "ask",
    "seed": 0
  },
  "output": {
    "folder": ""
  }
}
